Sheet: chopped
A1: x | B1: y | C1: t | D1: t | E1: y(inches)
A2: -47 | B2: 28 | C2: 0:00:00:58 | D2: 0:00:00:58 | E2: =RC[-3]*0.010416666666667 -> 0.29166666666667596
A3: -47 | B3: 46 | C3: 0:00:00:61 | D3: 0:00:00:61 | E3: =RC[-3]*0.010416666666667 -> 0.47916666666668195
A4: -48 | B4: 65 | C4: 0:00:00:65 | D4: 0:00:00:65 | E4: =RC[-3]*0.010416666666667 -> 0.67708333333335491
A5: -51 | B5: 86 | C5: 0:00:00:68 | D5: 0:00:00:68 | E5: =RC[-3]*0.010416666666667 -> 0.8958333333333619
A6: -52 | B6: 110 | C6: 0:00:00:71 | D6: 0:00:00:71 | E6: =RC[-3]*0.010416666666667 -> 1.1458333333333699
A7: -52 | B7: 134 | C7: 0:00:00:75 | D7: 0:00:00:75 | E7: =RC[-3]*0.010416666666667 -> 1.3958333333333779
A8: -53 | B8: 158 | C8: 0:00:00:78 | D8: 0:00:00:78 | E8: =RC[-3]*0.010416666666667 -> 1.6458333333333859
A9: -55 | B9: 182 | C9: 0:00:00:81 | D9: 0:00:00:81 | E9: =RC[-3]*0.010416666666667 -> 1.8958333333333939
A10: -55 | B10: 206 | C10: 0:00:00:85 | D10: 0:00:00:85 | E10: =RC[-3]*0.010416666666667 -> 2.1458333333334019
A11: -56 | B11: 230 | C11: 0:00:00:88 | D11: 0:00:00:88 | E11: =RC[-3]*0.010416666666667 -> 2.3958333333334099
A12: -58 | B12: 253 | C12: 0:00:00:91 | D12: 0:00:00:91 | E12: =RC[-3]*0.010416666666667 -> 2.6354166666667509
A13: -59 | B13: 271 | C13: 0:00:00:95 | D13: 0:00:00:95 | E13: =RC[-3]*0.010416666666667 -> 2.8229166666667567
A14: -60 | B14: 290 | C14: 0:00:00:98 | D14: 0:00:00:98 | E14: =RC[-3]*0.010416666666667 -> 3.0208333333334298
A15: -63 | B15: 310 | C15: 0:00:01:01 | D15: 0:00:01:01 | E15: =RC[-3]*0.010416666666667 -> 3.2291666666667695
A16: -66 | B16: 331 | C16: 0:00:01:05 | D16: 0:00:01:05 | E16: =RC[-3]*0.010416666666667 -> 3.4479166666667767
A17: -68 | B17: 350 | C17: 0:00:01:08 | D17: 0:00:01:08 | E17: =RC[-3]*0.010416666666667 -> 3.6458333333334498
A18: -68 | B18: 370 | C18: 0:00:01:11 | D18: 0:00:01:11 | E18: =RC[-3]*0.010416666666667 -> 3.8541666666667895
A19: -69 | B19: 390 | C19: 0:00:01:15 | D19: 0:00:01:15 | E19: =RC[-3]*0.010416666666667 -> 4.0625000000001297
A20: -71 | B20: 409 | C20: 0:00:01:18 | D20: 0:00:01:18 | E20: =RC[-3]*0.010416666666667 -> 4.2604166666668029
A21: -72 | B21: 426 | C21: 0:00:01:21 | D21: 0:00:01:21 | E21: =RC[-3]*0.010416666666667 -> 4.4375000000001412
A22: -74 | B22: 443 | C22: 0:00:01:25 | D22: 0:00:01:25 | E22: =RC[-3]*0.010416666666667 -> 4.6145833333334805
A23: -76 | B23: 459 | C23: 0:00:01:28 | D23: 0:00:01:28 | E23: =RC[-3]*0.010416666666667 -> 4.7812500000001528
A24: -79 | B24: 477 | C24: 0:00:01:31 | D24: 0:00:01:31 | E24: =RC[-3]*0.010416666666667 -> 4.968750000000159
A25: -81 | B25: 493 | C25: 0:00:01:35 | D25: 0:00:01:35 | E25: =RC[-3]*0.010416666666667 -> 5.1354166666668304
A26: -83 | B26: 509 | C26: 0:00:01:38 | D26: 0:00:01:38 | E26: =RC[-3]*0.010416666666667 -> 5.3020833333335027
A27: -84 | B27: 525 | C27: 0:00:01:41 | D27: 0:00:01:41 | E27: =RC[-3]*0.010416666666667 -> 5.468750000000175
A28: -86 | B28: 541 | C28: 0:00:01:45 | D28: 0:00:01:45 | E28: =RC[-3]*0.010416666666667 -> 5.6354166666668464
A29: -87 | B29: 555 | C29: 0:00:01:48 | D29: 0:00:01:48 | E29: =RC[-3]*0.010416666666667 -> 5.7812500000001847
A30: -89 | B30: 570 | C30: 0:00:01:51 | D30: 0:00:01:51 | E30: =RC[-3]*0.010416666666667 -> 5.9375000000001892
A31: -90 | B31: 585 | C31: 0:00:01:55 | D31: 0:00:01:55 | E31: =RC[-3]*0.010416666666667 -> 6.0937500000001945
A32: -92 | B32: 599 | C32: 0:00:01:58 | D32: 0:00:01:58 | E32: =RC[-3]*0.010416666666667 -> 6.2395833333335329
A33: -94 | B33: 612 | C33: 0:00:01:61 | D33: 0:00:01:61 | E33: =RC[-3]*0.010416666666667 -> 6.3750000000002034
A34: -96 | B34: 625 | C34: 0:00:01:65 | D34: 0:00:01:65 | E34: =RC[-3]*0.010416666666667 -> 6.5104166666668748
A35: -98 | B35: 637 | C35: 0:00:01:68 | D35: 0:00:01:68 | E35: =RC[-3]*0.010416666666667 -> 6.6354166666668783
A36: -100 | B36: 649 | C36: 0:00:01:71 | D36: 0:00:01:71 | E36: =RC[-3]*0.010416666666667 -> 6.7604166666668828
A37: -102 | B37: 661 | C37: 0:00:01:75 | D37: 0:00:01:75 | E37: =RC[-3]*0.010416666666667 -> 6.8854166666668863
A38: -105 | B38: 672 | C38: 0:00:01:78 | D38: 0:00:01:78 | E38: =RC[-3]*0.010416666666667 -> 7.0000000000002238
A39: -107 | B39: 683 | C39: 0:00:01:81 | D39: 0:00:01:81 | E39: =RC[-3]*0.010416666666667 -> 7.1145833333335604
A40: -109 | B40: 692 | C40: 0:00:01:85 | D40: 0:00:01:85 | E40: =RC[-3]*0.010416666666667 -> 7.2083333333335631
A41: -111 | B41: 702 | C41: 0:00:01:88 | D41: 0:00:01:88 | E41: =RC[-3]*0.010416666666667 -> 7.3125000000002336
A42: -114 | B42: 710 | C42: 0:00:01:91 | D42: 0:00:01:91 | E42: =RC[-3]*0.010416666666667 -> 7.3958333333335693
A43: -117 | B43: 718 | C43: 0:00:01:95 | D43: 0:00:01:95 | E43: =RC[-3]*0.010416666666667 -> 7.479166666666905
A44: -119 | B44: 726 | C44: 0:00:01:98 | D44: 0:00:01:98 | E44: =RC[-3]*0.010416666666667 -> 7.5625000000002416
A45: -122 | B45: 733 | C45: 0:00:02:01 | D45: 0:00:02:01 | E45: =RC[-3]*0.010416666666667 -> 7.6354166666669103
A46: -124 | B46: 739 | C46: 0:00:02:05 | D46: 0:00:02:05 | E46: =RC[-3]*0.010416666666667 -> 7.6979166666669121
A47: -127 | B47: 745 | C47: 0:00:02:08 | D47: 0:00:02:08 | E47: =RC[-3]*0.010416666666667 -> 7.7604166666669148
A48: -129 | B48: 751 | C48: 0:00:02:11 | D48: 0:00:02:11 | E48: =RC[-3]*0.010416666666667 -> 7.8229166666669165
A49: -131 | B49: 757 | C49: 0:00:02:15 | D49: 0:00:02:15 | E49: =RC[-3]*0.010416666666667 -> 7.8854166666669183
A50: -133 | B50: 762 | C50: 0:00:02:18 | D50: 0:00:02:18 | E50: =RC[-3]*0.010416666666667 -> 7.9375000000002531
A51: -137 | B51: 763 | C51: 0:00:02:21 | D51: 0:00:02:21 | E51: =RC[-3]*0.010416666666667 -> 7.9479166666669201
A52: -139 | B52: 763 | C52: 0:00:02:25 | D52: 0:00:02:25 | E52: =RC[-3]*0.010416666666667 -> 7.9479166666669201
A53: -79 | B53: 741 | C53: 0:00:02:28 | D53: 0:00:02:28 | E53: =RC[-3]*0.010416666666667 -> 7.718750000000246
A54: -79 | B54: 746 | C54: 0:00:02:31 | D54: 0:00:02:31 | E54: =RC[-3]*0.010416666666667 -> 7.7708333333335817
A55: -80 | B55: 751 | C55: 0:00:02:35 | D55: 0:00:02:35 | E55: =RC[-3]*0.010416666666667 -> 7.8229166666669165
A56: -81 | B56: 755 | C56: 0:00:02:38 | D56: 0:00:02:38 | E56: =RC[-3]*0.010416666666667 -> 7.8645833333335844
A57: -82 | B57: 759 | C57: 0:00:02:41 | D57: 0:00:02:41 | E57: =RC[-3]*0.010416666666667 -> 7.9062500000002522
A58: -82 | B58: 762 | C58: 0:00:02:45 | D58: 0:00:02:45 | E58: =RC[-3]*0.010416666666667 -> 7.9375000000002531
A59: -82 | B59: 763 | C59: 0:00:02:48 | D59: 0:00:02:48 | E59: =RC[-3]*0.010416666666667 -> 7.9479166666669201
A60: -80 | B60: 763 | C60: 0:00:02:51 | D60: 0:00:02:51 | E60: =RC[-3]*0.010416666666667 -> 7.9479166666669201
A61: -79 | B61: 763 | C61: 0:00:02:55 | D61: 0:00:02:55 | E61: =RC[-3]*0.010416666666667 -> 7.9479166666669201
A62: -77 | B62: 763 | C62: 0:00:02:58 | D62: 0:00:02:58 | E62: =RC[-3]*0.010416666666667 -> 7.9479166666669201
A63: -77 | B63: 763 | C63: 0:00:02:61 | D63: 0:00:02:61 | E63: =RC[-3]*0.010416666666667 -> 7.9479166666669201
A64: -77 | B64: 763 | C64: 0:00:02:65 | D64: 0:00:02:65 | E64: =RC[-3]*0.010416666666667 -> 7.9479166666669201
A65: -78 | B65: 763 | C65: 0:00:02:68 | D65: 0:00:02:68 | E65: =RC[-3]*0.010416666666667 -> 7.9479166666669201
A66: -78 | B66: 763 | C66: 0:00:02:71 | D66: 0:00:02:71 | E66: =RC[-3]*0.010416666666667 -> 7.9479166666669201
A67: -78 | B67: 763 | C67: 0:00:02:75 | D67: 0:00:02:75 | E67: =RC[-3]*0.010416666666667 -> 7.9479166666669201
A68: -79 | B68: 762 | C68: 0:00:02:78 | D68: 0:00:02:78 | E68: =RC[-3]*0.010416666666667 -> 7.9375000000002531
A69: -79 | B69: 761 | C69: 0:00:02:81 | D69: 0:00:02:81 | E69: =RC[-3]*0.010416666666667 -> 7.9270833333335862
A70: -80 | B70: 760 | C70: 0:00:02:85 | D70: 0:00:02:85 | E70: =RC[-3]*0.010416666666667 -> 7.9166666666669192
A71: -81 | B71: 758 | C71: 0:00:02:88 | D71: 0:00:02:88 | E71: =RC[-3]*0.010416666666667 -> 7.8958333333335853
A72: -81 | B72: 756 | C72: 0:00:02:91 | D72: 0:00:02:91 | E72: =RC[-3]*0.010416666666667 -> 7.8750000000002514
A73: -135 | B73: 746 | C73: 0:00:02:95 | D73: 0:00:02:95 | E73: =RC[-3]*0.010416666666667 -> 7.7708333333335817
A74: -135 | B74: 743 | C74: 0:00:02:98 | D74: 0:00:02:98 | E74: =RC[-3]*0.010416666666667 -> 7.73958333333358
A75: -134 | B75: 740 | C75: 0:00:03:01 | D75: 0:00:03:01 | E75: =RC[-3]*0.010416666666667 -> 7.7083333333335791
A76: -133 | B76: 736 | C76: 0:00:03:05 | D76: 0:00:03:05 | E76: =RC[-3]*0.010416666666667 -> 7.6666666666669112
A77: -132 | B77: 732 | C77: 0:00:03:08 | D77: 0:00:03:08 | E77: =RC[-3]*0.010416666666667 -> 7.6250000000002434
A78: -131 | B78: 728 | C78: 0:00:03:11 | D78: 0:00:03:11 | E78: =RC[-3]*0.010416666666667 -> 7.5833333333335755
A79: -131 | B79: 723 | C79: 0:00:03:15 | D79: 0:00:03:15 | E79: =RC[-3]*0.010416666666667 -> 7.5312500000002407
A80: -130 | B80: 718 | C80: 0:00:03:18 | D80: 0:00:03:18 | E80: =RC[-3]*0.010416666666667 -> 7.479166666666905
A81: -129 | B81: 713 | C81: 0:00:03:21 | D81: 0:00:03:21 | E81: =RC[-3]*0.010416666666667 -> 7.4270833333335702
A82: -128 | B82: 707 | C82: 0:00:03:25 | D82: 0:00:03:25 | E82: =RC[-3]*0.010416666666667 -> 7.3645833333335684
A83: -127 | B83: 701 | C83: 0:00:03:28 | D83: 0:00:03:28 | E83: =RC[-3]*0.010416666666667 -> 7.3020833333335666
A84: -126 | B84: 695 | C84: 0:00:03:31 | D84: 0:00:03:31 | E84: =RC[-3]*0.010416666666667 -> 7.2395833333335649
A85: -120 | B85: 690 | C85: 0:00:03:35 | D85: 0:00:03:35 | E85: =RC[-3]*0.010416666666667 -> 7.1875000000002292
A86: -119 | B86: 683 | C86: 0:00:03:38 | D86: 0:00:03:38 | E86: =RC[-3]*0.010416666666667 -> 7.1145833333335604
A87: -118 | B87: 676 | C87: 0:00:03:41 | D87: 0:00:03:41 | E87: =RC[-3]*0.010416666666667 -> 7.0416666666668917
A88: -117 | B88: 668 | C88: 0:00:03:45 | D88: 0:00:03:45 | E88: =RC[-3]*0.010416666666667 -> 6.9583333333335551
A89: -116 | B89: 660 | C89: 0:00:03:48 | D89: 0:00:03:48 | E89: =RC[-3]*0.010416666666667 -> 6.8750000000002194
A90: -113 | B90: 653 | C90: 0:00:03:51 | D90: 0:00:03:51 | E90: =RC[-3]*0.010416666666667 -> 6.8020833333335506
A91: -112 | B91: 644 | C91: 0:00:03:55 | D91: 0:00:03:55 | E91: =RC[-3]*0.010416666666667 -> 6.7083333333335471
A92: -111 | B92: 635 | C92: 0:00:03:58 | D92: 0:00:03:58 | E92: =RC[-3]*0.010416666666667 -> 6.6145833333335444
A93: -110 | B93: 625 | C93: 0:00:03:61 | D93: 0:00:03:61 | E93: =RC[-3]*0.010416666666667 -> 6.5104166666668748
A94: -109 | B94: 614 | C94: 0:00:03:65 | D94: 0:00:03:65 | E94: =RC[-3]*0.010416666666667 -> 6.3958333333335373
A95: -108 | B95: 603 | C95: 0:00:03:68 | D95: 0:00:03:68 | E95: =RC[-3]*0.010416666666667 -> 6.2812500000002007
A96: -107 | B96: 592 | C96: 0:00:03:71 | D96: 0:00:03:71 | E96: =RC[-3]*0.010416666666667 -> 6.1666666666668633
A97: -106 | B97: 580 | C97: 0:00:03:75 | D97: 0:00:03:75 | E97: =RC[-3]*0.010416666666667 -> 6.0416666666668597
A98: -106 | B98: 568 | C98: 0:00:03:78 | D98: 0:00:03:78 | E98: =RC[-3]*0.010416666666667 -> 5.9166666666668553
A99: -105 | B99: 556 | C99: 0:00:03:81 | D99: 0:00:03:81 | E99: =RC[-3]*0.010416666666667 -> 5.7916666666668517
A100: -104 | B100: 543 | C100: 0:00:03:85 | D100: 0:00:03:85 | E100: =RC[-3]*0.010416666666667 -> 5.6562500000001803
A101: -102 | B101: 530 | C101: 0:00:03:88 | D101: 0:00:03:88 | E101: =RC[-3]*0.010416666666667 -> 5.5208333333335098
A102: -100 | B102: 516 | C102: 0:00:03:91 | D102: 0:00:03:91 | E102: =RC[-3]*0.010416666666667 -> 5.3750000000001714
A103: -98 | B103: 501 | C103: 0:00:03:95 | D103: 0:00:03:95 | E103: =RC[-3]*0.010416666666667 -> 5.218750000000167
A104: -97 | B104: 487 | C104: 0:00:03:98 | D104: 0:00:03:98 | E104: =RC[-3]*0.010416666666667 -> 5.0729166666668286
A105: -95 | B105: 472 | C105: 0:00:04:01 | D105: 0:00:04:01 | E105: =RC[-3]*0.010416666666667 -> 4.9166666666668233
A106: -94 | B106: 457 | C106: 0:00:04:05 | D106: 0:00:04:05 | E106: =RC[-3]*0.010416666666667 -> 4.7604166666668188
A107: -93 | B107: 443 | C107: 0:00:04:08 | D107: 0:00:04:08 | E107: =RC[-3]*0.010416666666667 -> 4.6145833333334805
A108: -92 | B108: 427 | C108: 0:00:04:11 | D108: 0:00:04:11 | E108: =RC[-3]*0.010416666666667 -> 4.4479166666668091
A109: -90 | B109: 411 | C109: 0:00:04:15 | D109: 0:00:04:15 | E109: =RC[-3]*0.010416666666667 -> 4.2812500000001368
A110: -89 | B110: 395 | C110: 0:00:04:18 | D110: 0:00:04:18 | E110: =RC[-3]*0.010416666666667 -> 4.1145833333334645
A111: -88 | B111: 378 | C111: 0:00:04:21 | D111: 0:00:04:21 | E111: =RC[-3]*0.010416666666667 -> 3.9375000000001257
A112: -87 | B112: 361 | C112: 0:00:04:25 | D112: 0:00:04:25 | E112: =RC[-3]*0.010416666666667 -> 3.7604166666667869
A113: -86 | B113: 343 | C113: 0:00:04:28 | D113: 0:00:04:28 | E113: =RC[-3]*0.010416666666667 -> 3.5729166666667806
A114: -85 | B114: 326 | C114: 0:00:04:31 | D114: 0:00:04:31 | E114: =RC[-3]*0.010416666666667 -> 3.3958333333334418
A115: -84 | B115: 308 | C115: 0:00:04:35 | D115: 0:00:04:35 | E115: =RC[-3]*0.010416666666667 -> 3.2083333333334356
A116: -83 | B116: 289 | C116: 0:00:04:38 | D116: 0:00:04:38 | E116: =RC[-3]*0.010416666666667 -> 3.0104166666667629
A117: -82 | B117: 269 | C117: 0:00:04:41 | D117: 0:00:04:41 | E117: =RC[-3]*0.010416666666667 -> 2.8020833333334227
A118: -80 | B118: 248 | C118: 0:00:04:45 | D118: 0:00:04:45 | E118: =RC[-3]*0.010416666666667 -> 2.5833333333334156
A119: -79 | B119: 228 | C119: 0:00:04:48 | D119: 0:00:04:48 | E119: =RC[-3]*0.010416666666667 -> 2.3750000000000759
A120: -78 | B120: 207 | C120: 0:00:04:51 | D120: 0:00:04:51 | E120: =RC[-3]*0.010416666666667 -> 2.1562500000000688
A121: -76 | B121: 184 | C121: 0:00:04:55 | D121: 0:00:04:55 | E121: =RC[-3]*0.010416666666667 -> 1.9166666666667278
A122: -75 | B122: 163 | C122: 0:00:04:58 | D122: 0:00:04:58 | E122: =RC[-3]*0.010416666666667 -> 1.6979166666667209
A123: -74 | B123: 141 | C123: 0:00:04:61 | D123: 0:00:04:61 | E123: =RC[-3]*0.010416666666667 -> 1.4687500000000469
A124: -73 | B124: 119 | C124: 0:00:04:65 | D124: 0:00:04:65 | E124: =RC[-3]*0.010416666666667 -> 1.239583333333373
A125: -72 | B125: 96 | C125: 0:00:04:68 | D125: 0:00:04:68 | E125: =RC[-3]*0.010416666666667 -> 1.000000000000032
A126: -71 | B126: 73 | C126: 0:00:04:71 | D126: 0:00:04:71 | E126: =RC[-3]*0.010416666666667 -> 0.76041666666669094
A127: -70 | B127: 49 | C127: 0:00:04:75 | D127: 0:00:04:75 | E127: =RC[-3]*0.010416666666667 -> 0.51041666666668295
A128: -68 | B128: 23 | C128: 0:00:04:78 | D128: 0:00:04:78 | E128: =RC[-3]*0.010416666666667 -> 0.23958333333334098
A129: -66 | B129: -2 | C129: 0:00:04:81 | D129: 0:00:04:81 | E129: =RC[-3]*0.010416666666667 -> -2.0833333333333998E-2
A130: -65 | B130: -28 | C130: 0:00:04:85 | D130: 0:00:04:85 | E130: =RC[-3]*0.010416666666667 -> -0.29166666666667596
A131: -64 | B131: -52 | C131: 0:00:04:88 | D131: 0:00:04:88 | E131: =RC[-3]*0.010416666666667 -> -0.54166666666668395

Sheet: IMG_6976
A2: Track
A3: Label : | B3: Label
A4: Coords (x,y:px; t:time)
A5: x | B5: y | C5: t | D5: y(inches)
A6: 0 | B6: 0 | C6: 0:00:00:00 | D6: =RC[-2]*0.010416666666667 -> 0
A7: -47 | B7: -27 | C7: 0:00:00:05 | D7: =RC[-2]*0.010416666666667 -> -0.28125000000000899
A8: -47 | B8: -27 | C8: 0:00:00:08 | D8: =RC[-2]*0.010416666666667 -> -0.28125000000000899
A9: -47 | B9: -27 | C9: 0:00:00:11 | D9: =RC[-2]*0.010416666666667 -> -0.28125000000000899
A10: -47 | B10: -27 | C10: 0:00:00:15 | D10: =RC[-2]*0.010416666666667 -> -0.28125000000000899
A11: -47 | B11: -27 | C11: 0:00:00:18 | D11: =RC[-2]*0.010416666666667 -> -0.28125000000000899
A12: -47 | B12: -28 | C12: 0:00:00:21 | D12: =RC[-2]*0.010416666666667 -> -0.29166666666667596
A13: -47 | B13: -27 | C13: 0:00:00:25 | D13: =RC[-2]*0.010416666666667 -> -0.28125000000000899
A14: -47 | B14: -27 | C14: 0:00:00:28 | D14: =RC[-2]*0.010416666666667 -> -0.28125000000000899
A15: -47 | B15: -28 | C15: 0:00:00:31 | D15: =RC[-2]*0.010416666666667 -> -0.29166666666667596
A16: -47 | B16: -28 | C16: 0:00:00:35 | D16: =RC[-2]*0.010416666666667 -> -0.29166666666667596
A17: -47 | B17: -27 | C17: 0:00:00:38 | D17: =RC[-2]*0.010416666666667 -> -0.28125000000000899
A18: -47 | B18: -27 | C18: 0:00:00:41 | D18: =RC[-2]*0.010416666666667 -> -0.28125000000000899
A19: -47 | B19: -22 | C19: 0:00:00:45 | D19: =RC[-2]*0.010416666666667 -> -0.22916666666667398
A20: -47 | B20: -14 | C20: 0:00:00:48 | D20: =RC[-2]*0.010416666666667 -> -0.14583333333333798
A21: -47 | B21: -2 | C21: 0:00:00:51 | D21: =RC[-2]*0.010416666666667 -> -2.0833333333333998E-2
A22: -48 | B22: 12 | C22: 0:00:00:55 | D22: =RC[-2]*0.010416666666667 -> 0.125000000000004
A23: -47 | B23: 28 | C23: 0:00:00:58 | D23: =RC[-2]*0.010416666666667 -> 0.29166666666667596
A24: -47 | B24: 46 | C24: 0:00:00:61 | D24: =RC[-2]*0.010416666666667 -> 0.47916666666668195
A25: -48 | B25: 65 | C25: 0:00:00:65 | D25: =RC[-2]*0.010416666666667 -> 0.67708333333335491
A26: -51 | B26: 86 | C26: 0:00:00:68 | D26: =RC[-2]*0.010416666666667 -> 0.8958333333333619
A27: -52 | B27: 110 | C27: 0:00:00:71 | D27: =RC[-2]*0.010416666666667 -> 1.1458333333333699
A28: -52 | B28: 134 | C28: 0:00:00:75 | D28: =RC[-2]*0.010416666666667 -> 1.3958333333333779
A29: -53 | B29: 158 | C29: 0:00:00:78 | D29: =RC[-2]*0.010416666666667 -> 1.6458333333333859
A30: -55 | B30: 182 | C30: 0:00:00:81 | D30: =RC[-2]*0.010416666666667 -> 1.8958333333333939
A31: -55 | B31: 206 | C31: 0:00:00:85 | D31: =RC[-2]*0.010416666666667 -> 2.1458333333334019
A32: -56 | B32: 230 | C32: 0:00:00:88 | D32: =RC[-2]*0.010416666666667 -> 2.3958333333334099
A33: -58 | B33: 253 | C33: 0:00:00:91 | D33: =RC[-2]*0.010416666666667 -> 2.6354166666667509
A34: -59 | B34: 271 | C34: 0:00:00:95 | D34: =RC[-2]*0.010416666666667 -> 2.8229166666667567
A35: -60 | B35: 290 | C35: 0:00:00:98 | D35: =RC[-2]*0.010416666666667 -> 3.0208333333334298
A36: -63 | B36: 310 | C36: 0:00:01:01 | D36: =RC[-2]*0.010416666666667 -> 3.2291666666667695
A37: -66 | B37: 331 | C37: 0:00:01:05 | D37: =RC[-2]*0.010416666666667 -> 3.4479166666667767
A38: -68 | B38: 350 | C38: 0:00:01:08 | D38: =RC[-2]*0.010416666666667 -> 3.6458333333334498
A39: -68 | B39: 370 | C39: 0:00:01:11 | D39: =RC[-2]*0.010416666666667 -> 3.8541666666667895
A40: -69 | B40: 390 | C40: 0:00:01:15 | D40: =RC[-2]*0.010416666666667 -> 4.0625000000001297
A41: -71 | B41: 409 | C41: 0:00:01:18 | D41: =RC[-2]*0.010416666666667 -> 4.2604166666668029
A42: -72 | B42: 426 | C42: 0:00:01:21 | D42: =RC[-2]*0.010416666666667 -> 4.4375000000001412
A43: -74 | B43: 443 | C43: 0:00:01:25 | D43: =RC[-2]*0.010416666666667 -> 4.6145833333334805
A44: -76 | B44: 459 | C44: 0:00:01:28 | D44: =RC[-2]*0.010416666666667 -> 4.7812500000001528
A45: -79 | B45: 477 | C45: 0:00:01:31 | D45: =RC[-2]*0.010416666666667 -> 4.968750000000159
A46: -81 | B46: 493 | C46: 0:00:01:35 | D46: =RC[-2]*0.010416666666667 -> 5.1354166666668304
A47: -83 | B47: 509 | C47: 0:00:01:38 | D47: =RC[-2]*0.010416666666667 -> 5.3020833333335027
A48: -84 | B48: 525 | C48: 0:00:01:41 | D48: =RC[-2]*0.010416666666667 -> 5.468750000000175
A49: -86 | B49: 541 | C49: 0:00:01:45 | D49: =RC[-2]*0.010416666666667 -> 5.6354166666668464
A50: -87 | B50: 555 | C50: 0:00:01:48 | D50: =RC[-2]*0.010416666666667 -> 5.7812500000001847
A51: -89 | B51: 570 | C51: 0:00:01:51 | D51: =RC[-2]*0.010416666666667 -> 5.9375000000001892
A52: -90 | B52: 585 | C52: 0:00:01:55 | D52: =RC[-2]*0.010416666666667 -> 6.0937500000001945
A53: -92 | B53: 599 | C53: 0:00:01:58 | D53: =RC[-2]*0.010416666666667 -> 6.2395833333335329
A54: -94 | B54: 612 | C54: 0:00:01:61 | D54: =RC[-2]*0.010416666666667 -> 6.3750000000002034
A55: -96 | B55: 625 | C55: 0:00:01:65 | D55: =RC[-2]*0.010416666666667 -> 6.5104166666668748
A56: -98 | B56: 637 | C56: 0:00:01:68 | D56: =RC[-2]*0.010416666666667 -> 6.6354166666668783
A57: -100 | B57: 649 | C57: 0:00:01:71 | D57: =RC[-2]*0.010416666666667 -> 6.7604166666668828
A58: -102 | B58: 661 | C58: 0:00:01:75 | D58: =RC[-2]*0.010416666666667 -> 6.8854166666668863
A59: -105 | B59: 672 | C59: 0:00:01:78 | D59: =RC[-2]*0.010416666666667 -> 7.0000000000002238
A60: -107 | B60: 683 | C60: 0:00:01:81 | D60: =RC[-2]*0.010416666666667 -> 7.1145833333335604
A61: -109 | B61: 692 | C61: 0:00:01:85 | D61: =RC[-2]*0.010416666666667 -> 7.2083333333335631
A62: -111 | B62: 702 | C62: 0:00:01:88 | D62: =RC[-2]*0.010416666666667 -> 7.3125000000002336
A63: -114 | B63: 710 | C63: 0:00:01:91 | D63: =RC[-2]*0.010416666666667 -> 7.3958333333335693
A64: -117 | B64: 718 | C64: 0:00:01:95 | D64: =RC[-2]*0.010416666666667 -> 7.479166666666905
A65: -119 | B65: 726 | C65: 0:00:01:98 | D65: =RC[-2]*0.010416666666667 -> 7.5625000000002416
A66: -122 | B66: 733 | C66: 0:00:02:01 | D66: =RC[-2]*0.010416666666667 -> 7.6354166666669103
A67: -124 | B67: 739 | C67: 0:00:02:05 | D67: =RC[-2]*0.010416666666667 -> 7.6979166666669121
A68: -127 | B68: 745 | C68: 0:00:02:08 | D68: =RC[-2]*0.010416666666667 -> 7.7604166666669148
A69: -129 | B69: 751 | C69: 0:00:02:11 | D69: =RC[-2]*0.010416666666667 -> 7.8229166666669165
A70: -131 | B70: 757 | C70: 0:00:02:15 | D70: =RC[-2]*0.010416666666667 -> 7.8854166666669183
A71: -133 | B71: 762 | C71: 0:00:02:18 | D71: =RC[-2]*0.010416666666667 -> 7.9375000000002531
A72: -137 | B72: 763 | C72: 0:00:02:21 | D72: =RC[-2]*0.010416666666667 -> 7.9479166666669201
A73: -139 | B73: 763 | C73: 0:00:02:25 | D73: =RC[-2]*0.010416666666667 -> 7.9479166666669201
A74: -79 | B74: 741 | C74: 0:00:02:28 | D74: =RC[-2]*0.010416666666667 -> 7.718750000000246
A75: -79 | B75: 746 | C75: 0:00:02:31 | D75: =RC[-2]*0.010416666666667 -> 7.7708333333335817
A76: -80 | B76: 751 | C76: 0:00:02:35 | D76: =RC[-2]*0.010416666666667 -> 7.8229166666669165
A77: -81 | B77: 755 | C77: 0:00:02:38 | D77: =RC[-2]*0.010416666666667 -> 7.8645833333335844
A78: -82 | B78: 759 | C78: 0:00:02:41 | D78: =RC[-2]*0.010416666666667 -> 7.9062500000002522
A79: -82 | B79: 762 | C79: 0:00:02:45 | D79: =RC[-2]*0.010416666666667 -> 7.9375000000002531
A80: -82 | B80: 763 | C80: 0:00:02:48 | D80: =RC[-2]*0.010416666666667 -> 7.9479166666669201
A81: -80 | B81: 763 | C81: 0:00:02:51 | D81: =RC[-2]*0.010416666666667 -> 7.9479166666669201
A82: -79 | B82: 763 | C82: 0:00:02:55 | D82: =RC[-2]*0.010416666666667 -> 7.9479166666669201
A83: -77 | B83: 763 | C83: 0:00:02:58 | D83: =RC[-2]*0.010416666666667 -> 7.9479166666669201
A84: -77 | B84: 763 | C84: 0:00:02:61 | D84: =RC[-2]*0.010416666666667 -> 7.9479166666669201
A85: -77 | B85: 763 | C85: 0:00:02:65 | D85: =RC[-2]*0.010416666666667 -> 7.9479166666669201
A86: -78 | B86: 763 | C86: 0:00:02:68 | D86: =RC[-2]*0.010416666666667 -> 7.9479166666669201
A87: -78 | B87: 763 | C87: 0:00:02:71 | D87: =RC[-2]*0.010416666666667 -> 7.9479166666669201
A88: -78 | B88: 763 | C88: 0:00:02:75 | D88: =RC[-2]*0.010416666666667 -> 7.9479166666669201
A89: -79 | B89: 762 | C89: 0:00:02:78 | D89: =RC[-2]*0.010416666666667 -> 7.9375000000002531
A90: -79 | B90: 761 | C90: 0:00:02:81 | D90: =RC[-2]*0.010416666666667 -> 7.9270833333335862
A91: -80 | B91: 760 | C91: 0:00:02:85 | D91: =RC[-2]*0.010416666666667 -> 7.9166666666669192
A92: -81 | B92: 758 | C92: 0:00:02:88 | D92: =RC[-2]*0.010416666666667 -> 7.8958333333335853
A93: -81 | B93: 756 | C93: 0:00:02:91 | D93: =RC[-2]*0.010416666666667 -> 7.8750000000002514
A94: -135 | B94: 746 | C94: 0:00:02:95 | D94: =RC[-2]*0.010416666666667 -> 7.7708333333335817
A95: -135 | B95: 743 | C95: 0:00:02:98 | D95: =RC[-2]*0.010416666666667 -> 7.73958333333358
A96: -134 | B96: 740 | C96: 0:00:03:01 | D96: =RC[-2]*0.010416666666667 -> 7.7083333333335791
A97: -133 | B97: 736 | C97: 0:00:03:05 | D97: =RC[-2]*0.010416666666667 -> 7.6666666666669112
A98: -132 | B98: 732 | C98: 0:00:03:08 | D98: =RC[-2]*0.010416666666667 -> 7.6250000000002434
A99: -131 | B99: 728 | C99: 0:00:03:11 | D99: =RC[-2]*0.010416666666667 -> 7.5833333333335755
A100: -131 | B100: 723 | C100: 0:00:03:15 | D100: =RC[-2]*0.010416666666667 -> 7.5312500000002407
A101: -130 | B101: 718 | C101: 0:00:03:18 | D101: =RC[-2]*0.010416666666667 -> 7.479166666666905
A102: -129 | B102: 713 | C102: 0:00:03:21 | D102: =RC[-2]*0.010416666666667 -> 7.4270833333335702
A103: -128 | B103: 707 | C103: 0:00:03:25 | D103: =RC[-2]*0.010416666666667 -> 7.3645833333335684
A104: -127 | B104: 701 | C104: 0:00:03:28 | D104: =RC[-2]*0.010416666666667 -> 7.3020833333335666
A105: -126 | B105: 695 | C105: 0:00:03:31 | D105: =RC[-2]*0.010416666666667 -> 7.2395833333335649
A106: -120 | B106: 690 | C106: 0:00:03:35 | D106: =RC[-2]*0.010416666666667 -> 7.1875000000002292
A107: -119 | B107: 683 | C107: 0:00:03:38 | D107: =RC[-2]*0.010416666666667 -> 7.1145833333335604
A108: -118 | B108: 676 | C108: 0:00:03:41 | D108: =RC[-2]*0.010416666666667 -> 7.0416666666668917
A109: -117 | B109: 668 | C109: 0:00:03:45 | D109: =RC[-2]*0.010416666666667 -> 6.9583333333335551
A110: -116 | B110: 660 | C110: 0:00:03:48 | D110: =RC[-2]*0.010416666666667 -> 6.8750000000002194
A111: -113 | B111: 653 | C111: 0:00:03:51 | D111: =RC[-2]*0.010416666666667 -> 6.8020833333335506
A112: -112 | B112: 644 | C112: 0:00:03:55 | D112: =RC[-2]*0.010416666666667 -> 6.7083333333335471
A113: -111 | B113: 635 | C113: 0:00:03:58 | D113: =RC[-2]*0.010416666666667 -> 6.6145833333335444
A114: -110 | B114: 625 | C114: 0:00:03:61 | D114: =RC[-2]*0.010416666666667 -> 6.5104166666668748
A115: -109 | B115: 614 | C115: 0:00:03:65 | D115: =RC[-2]*0.010416666666667 -> 6.3958333333335373
A116: -108 | B116: 603 | C116: 0:00:03:68 | D116: =RC[-2]*0.010416666666667 -> 6.2812500000002007
A117: -107 | B117: 592 | C117: 0:00:03:71 | D117: =RC[-2]*0.010416666666667 -> 6.1666666666668633
A118: -106 | B118: 580 | C118: 0:00:03:75 | D118: =RC[-2]*0.010416666666667 -> 6.0416666666668597
A119: -106 | B119: 568 | C119: 0:00:03:78 | D119: =RC[-2]*0.010416666666667 -> 5.9166666666668553
A120: -105 | B120: 556 | C120: 0:00:03:81 | D120: =RC[-2]*0.010416666666667 -> 5.7916666666668517
A121: -104 | B121: 543 | C121: 0:00:03:85 | D121: =RC[-2]*0.010416666666667 -> 5.6562500000001803
A122: -102 | B122: 530 | C122: 0:00:03:88 | D122: =RC[-2]*0.010416666666667 -> 5.5208333333335098
A123: -100 | B123: 516 | C123: 0:00:03:91 | D123: =RC[-2]*0.010416666666667 -> 5.3750000000001714
A124: -98 | B124: 501 | C124: 0:00:03:95 | D124: =RC[-2]*0.010416666666667 -> 5.218750000000167
A125: -97 | B125: 487 | C125: 0:00:03:98 | D125: =RC[-2]*0.010416666666667 -> 5.0729166666668286
A126: -95 | B126: 472 | C126: 0:00:04:01 | D126: =RC[-2]*0.010416666666667 -> 4.9166666666668233
A127: -94 | B127: 457 | C127: 0:00:04:05 | D127: =RC[-2]*0.010416666666667 -> 4.7604166666668188
A128: -93 | B128: 443 | C128: 0:00:04:08 | D128: =RC[-2]*0.010416666666667 -> 4.6145833333334805
A129: -92 | B129: 427 | C129: 0:00:04:11 | D129: =RC[-2]*0.010416666666667 -> 4.4479166666668091
A130: -90 | B130: 411 | C130: 0:00:04:15 | D130: =RC[-2]*0.010416666666667 -> 4.2812500000001368
A131: -89 | B131: 395 | C131: 0:00:04:18 | D131: =RC[-2]*0.010416666666667 -> 4.1145833333334645
A132: -88 | B132: 378 | C132: 0:00:04:21 | D132: =RC[-2]*0.010416666666667 -> 3.9375000000001257
A133: -87 | B133: 361 | C133: 0:00:04:25 | D133: =RC[-2]*0.010416666666667 -> 3.7604166666667869
A134: -86 | B134: 343 | C134: 0:00:04:28 | D134: =RC[-2]*0.010416666666667 -> 3.5729166666667806
A135: -85 | B135: 326 | C135: 0:00:04:31 | D135: =RC[-2]*0.010416666666667 -> 3.3958333333334418
A136: -84 | B136: 308 | C136: 0:00:04:35 | D136: =RC[-2]*0.010416666666667 -> 3.2083333333334356
A137: -83 | B137: 289 | C137: 0:00:04:38 | D137: =RC[-2]*0.010416666666667 -> 3.0104166666667629
A138: -82 | B138: 269 | C138: 0:00:04:41 | D138: =RC[-2]*0.010416666666667 -> 2.8020833333334227
A139: -80 | B139: 248 | C139: 0:00:04:45 | D139: =RC[-2]*0.010416666666667 -> 2.5833333333334156
A140: -79 | B140: 228 | C140: 0:00:04:48 | D140: =RC[-2]*0.010416666666667 -> 2.3750000000000759
A141: -78 | B141: 207 | C141: 0:00:04:51 | D141: =RC[-2]*0.010416666666667 -> 2.1562500000000688
A142: -76 | B142: 184 | C142: 0:00:04:55 | D142: =RC[-2]*0.010416666666667 -> 1.9166666666667278
A143: -75 | B143: 163 | C143: 0:00:04:58 | D143: =RC[-2]*0.010416666666667 -> 1.6979166666667209
A144: -74 | B144: 141 | C144: 0:00:04:61 | D144: =RC[-2]*0.010416666666667 -> 1.4687500000000469
A145: -73 | B145: 119 | C145: 0:00:04:65 | D145: =RC[-2]*0.010416666666667 -> 1.239583333333373
A146: -72 | B146: 96 | C146: 0:00:04:68 | D146: =RC[-2]*0.010416666666667 -> 1.000000000000032
A147: -71 | B147: 73 | C147: 0:00:04:71 | D147: =RC[-2]*0.010416666666667 -> 0.76041666666669094
A148: -70 | B148: 49 | C148: 0:00:04:75 | D148: =RC[-2]*0.010416666666667 -> 0.51041666666668295
A149: -68 | B149: 23 | C149: 0:00:04:78 | D149: =RC[-2]*0.010416666666667 -> 0.23958333333334098
A150: -66 | B150: -2 | C150: 0:00:04:81 | D150: =RC[-2]*0.010416666666667 -> -2.0833333333333998E-2
A151: -65 | B151: -28 | C151: 0:00:04:85 | D151: =RC[-2]*0.010416666666667 -> -0.29166666666667596
A152: -64 | B152: -52 | C152: 0:00:04:88 | D152: =RC[-2]*0.010416666666667 -> -0.54166666666668395